{
  "vector_id": "C31-SSA-003-register-smuggling-value-ref",
  "spec_version": "conformance/v1.0.0",
  "proto_version": "cortex_rmvm_v3_1",
  "description": "Assert binding from non-fetch/non-project register should reject.",
  "manifest": {
    "request_id": "req-C31-SSA-003-register-smuggling-value-ref",
    "handles": [
      {
        "ref": "H0",
        "type_id": "normative.preference",
        "availability": "READY",
        "subject": "user:vinz",
        "predicate_label": "prefers_beverage",
        "trust_tier": "TIER_3_CONFIRMED",
        "taint": [],
        "scope": "SCOPE_GLOBAL",
        "signature_summary": "prefers_beverage for user:vinz",
        "conflict_group_id": "conflict:prefers_beverage:user:vinz:global",
        "open_end": true
      }
    ],
    "selectors": [
      {
        "sel": "S0",
        "description": "Find preferences for subject",
        "params": [
          {
            "name": "subject",
            "type": "PARAM_STRING",
            "enum_values": []
          }
        ],
        "cost_weight": 1.25,
        "return_type": "RETURN_HANDLE_SET"
      }
    ],
    "context": [],
    "budget": {
      "max_ops": 128,
      "max_join_depth": 3,
      "max_fanout": 64,
      "max_total_cost": 256.0
    }
  },
  "plan": {
    "request_id": "req-C31-SSA-003-register-smuggling-value-ref",
    "steps": [
      {
        "out": "r0",
        "op": {
          "kind": "apply_selector",
          "selector_ref": "S0",
          "params": {
            "subject": {
              "kind": "s",
              "value": "user:vinz"
            }
          }
        }
      },
      {
        "out": "r1",
        "op": {
          "kind": "assert",
          "assertion_type": "ASSERT_WORLD_FACT",
          "bindings": {
            "x": {
              "reg": "r0",
              "field_path": "ref"
            }
          },
          "citations": []
        }
      }
    ],
    "outputs": []
  },
  "execute_options": {
    "allow_partial_on_stall": false,
    "degraded_mode": false,
    "broken_lineage_handles": [],
    "narrative_templates": []
  },
  "expect": {
    "status": "REJECTED",
    "error_code": "SCHEMA_VIOLATION",
    "semantic_root": null,
    "verified_blocks": null,
    "stall": null
  },
  "determinism": {
    "assert_response_cpe_sha256": "6d65b3b82b0f08bda722c143f823a2683810e4eaba23d0c4bebcc38f60f78e7b",
    "assert_semantic_root": true
  }
}
