{
  "vector_id": "C31-COST-003-join-depth-overflow",
  "spec_version": "conformance/v1.0.0",
  "proto_version": "cortex_rmvm_v3_1",
  "description": "Join depth over max should reject.",
  "manifest": {
    "request_id": "req-C31-COST-003-join-depth-overflow",
    "handles": [
      {
        "ref": "H0",
        "type_id": "normative.preference",
        "availability": "READY",
        "subject": "user:vinz",
        "predicate_label": "prefers_beverage",
        "trust_tier": "TIER_3_CONFIRMED",
        "taint": [],
        "scope": "SCOPE_GLOBAL",
        "signature_summary": "prefers_beverage for user:vinz",
        "conflict_group_id": "conflict:prefers_beverage:user:vinz:global",
        "open_end": true
      }
    ],
    "selectors": [
      {
        "sel": "S0",
        "description": "Find preferences for subject",
        "params": [
          {
            "name": "subject",
            "type": "PARAM_STRING",
            "enum_values": []
          }
        ],
        "cost_weight": 1.25,
        "return_type": "RETURN_HANDLE_SET"
      }
    ],
    "context": [],
    "budget": {
      "max_ops": 128,
      "max_join_depth": 3,
      "max_fanout": 64,
      "max_total_cost": 256.0
    }
  },
  "plan": {
    "request_id": "req-C31-COST-003-join-depth-overflow",
    "steps": [
      {
        "out": "r0",
        "op": {
          "kind": "fetch",
          "handle_ref": "H0"
        }
      },
      {
        "out": "r1",
        "op": {
          "kind": "fetch",
          "handle_ref": "H0"
        }
      },
      {
        "out": "r2",
        "op": {
          "kind": "join",
          "left_reg": "r0",
          "right_reg": "r1",
          "edge_type": "EDGE_SAME_ENTITY"
        }
      },
      {
        "out": "r3",
        "op": {
          "kind": "join",
          "left_reg": "r2",
          "right_reg": "r0",
          "edge_type": "EDGE_SAME_ENTITY"
        }
      },
      {
        "out": "r4",
        "op": {
          "kind": "join",
          "left_reg": "r3",
          "right_reg": "r0",
          "edge_type": "EDGE_SAME_ENTITY"
        }
      },
      {
        "out": "r5",
        "op": {
          "kind": "join",
          "left_reg": "r4",
          "right_reg": "r0",
          "edge_type": "EDGE_SAME_ENTITY"
        }
      }
    ],
    "outputs": []
  },
  "execute_options": {
    "allow_partial_on_stall": false,
    "degraded_mode": false,
    "broken_lineage_handles": [],
    "narrative_templates": []
  },
  "expect": {
    "status": "REJECTED",
    "error_code": "GRAPH_TRAVERSAL_LIMIT",
    "semantic_root": null,
    "verified_blocks": null,
    "stall": null
  },
  "determinism": {
    "assert_response_cpe_sha256": "7218533c504dbae0357e73f973e8a9a23a60ff05d58eb03519a9738b15d57587",
    "assert_semantic_root": true
  }
}
