{
  "vector_id": "C31-SEC-005-trust-gate-policy-tier2-required",
  "spec_version": "conformance/v1.0.0",
  "proto_version": "cortex_rmvm_v3_1",
  "description": "Policy assertion below TIER_2 should reject.",
  "manifest": {
    "request_id": "req-C31-SEC-005-trust-gate-policy-tier2-required",
    "handles": [
      {
        "ref": "H0",
        "type_id": "normative.preference",
        "availability": "READY",
        "subject": "user:vinz",
        "predicate_label": "prefers_beverage",
        "trust_tier": "TIER_1_ASSERTED",
        "taint": [],
        "scope": "SCOPE_GLOBAL",
        "signature_summary": "prefers_beverage for user:vinz",
        "conflict_group_id": "conflict:prefers_beverage:user:vinz:global",
        "open_end": true
      }
    ],
    "selectors": [
      {
        "sel": "S0",
        "description": "Find preferences for subject",
        "params": [
          {
            "name": "subject",
            "type": "PARAM_STRING",
            "enum_values": []
          }
        ],
        "cost_weight": 1.25,
        "return_type": "RETURN_HANDLE_SET"
      }
    ],
    "context": [],
    "budget": {
      "max_ops": 128,
      "max_join_depth": 3,
      "max_fanout": 64,
      "max_total_cost": 256.0
    }
  },
  "plan": {
    "request_id": "req-C31-SEC-005-trust-gate-policy-tier2-required",
    "steps": [
      {
        "out": "r0",
        "op": {
          "kind": "fetch",
          "handle_ref": "H0"
        }
      },
      {
        "out": "r1",
        "op": {
          "kind": "assert",
          "assertion_type": "ASSERT_DECISION",
          "bindings": {
            "who": {
              "reg": "r0",
              "field_path": "meta.subject"
            }
          },
          "citations": []
        }
      }
    ],
    "outputs": []
  },
  "execute_options": {
    "allow_partial_on_stall": false,
    "degraded_mode": false,
    "broken_lineage_handles": [],
    "narrative_templates": []
  },
  "expect": {
    "status": "REJECTED",
    "error_code": "UNTRUSTED_PROVENANCE",
    "semantic_root": null,
    "verified_blocks": null,
    "stall": null
  },
  "determinism": {
    "assert_response_cpe_sha256": "295455c175a2eb0490a983af03a5b5732deab9bfc167eacdf147ee3dd5aad648",
    "assert_semantic_root": true
  }
}
