{
  "vector_id": "C31-STALL-002-archival-pending-fetch-stall",
  "spec_version": "conformance/v1.0.0",
  "proto_version": "cortex_rmvm_v3_1",
  "description": "ARCHIVAL_PENDING handle fetch should stall.",
  "manifest": {
    "request_id": "req-C31-STALL-002-archival-pending-fetch-stall",
    "handles": [
      {
        "ref": "H0",
        "type_id": "normative.preference",
        "availability": "ARCHIVAL_PENDING",
        "subject": "user:vinz",
        "predicate_label": "prefers_beverage",
        "trust_tier": "TIER_3_CONFIRMED",
        "taint": [],
        "scope": "SCOPE_GLOBAL",
        "signature_summary": "prefers_beverage for user:vinz",
        "conflict_group_id": "conflict:prefers_beverage:user:vinz:global",
        "open_end": true
      }
    ],
    "selectors": [
      {
        "sel": "S0",
        "description": "Find preferences for subject",
        "params": [
          {
            "name": "subject",
            "type": "PARAM_STRING",
            "enum_values": []
          }
        ],
        "cost_weight": 1.25,
        "return_type": "RETURN_HANDLE_SET"
      }
    ],
    "context": [],
    "budget": {
      "max_ops": 128,
      "max_join_depth": 3,
      "max_fanout": 64,
      "max_total_cost": 256.0
    }
  },
  "plan": {
    "request_id": "req-C31-STALL-002-archival-pending-fetch-stall",
    "steps": [
      {
        "out": "r0",
        "op": {
          "kind": "fetch",
          "handle_ref": "H0"
        }
      }
    ],
    "outputs": []
  },
  "execute_options": {
    "allow_partial_on_stall": false,
    "degraded_mode": false,
    "broken_lineage_handles": [],
    "narrative_templates": []
  },
  "expect": {
    "status": "STALL",
    "error_code": null,
    "semantic_root": null,
    "verified_blocks": null,
    "stall": {
      "handle_ref": "H0",
      "availability": "ARCHIVAL_PENDING",
      "retrieval_ticket_present": true
    }
  },
  "determinism": {
    "assert_response_cpe_sha256": "f7af81b3497ec4a5ce946ac7ad0443002f2bcbac190be34ce83578b2a262045a",
    "assert_semantic_root": true
  }
}
