{
  "vector_id": "C31-CORE-001-happy-fetch-project-assert",
  "spec_version": "conformance/v1.0.0",
  "proto_version": "cortex_rmvm_v3_1",
  "description": "Happy path fetch/project/assert.",
  "manifest": {
    "request_id": "req-C31-CORE-001-happy-fetch-project-assert",
    "handles": [
      {
        "ref": "H0",
        "type_id": "normative.preference",
        "availability": "READY",
        "subject": "user:vinz",
        "predicate_label": "prefers_beverage",
        "trust_tier": "TIER_3_CONFIRMED",
        "taint": [],
        "scope": "SCOPE_GLOBAL",
        "signature_summary": "prefers_beverage for user:vinz",
        "conflict_group_id": "conflict:prefers_beverage:user:vinz:global",
        "open_end": true
      }
    ],
    "selectors": [
      {
        "sel": "S0",
        "description": "Find preferences for subject",
        "params": [
          {
            "name": "subject",
            "type": "PARAM_STRING",
            "enum_values": []
          }
        ],
        "cost_weight": 1.25,
        "return_type": "RETURN_HANDLE_SET"
      }
    ],
    "context": [],
    "budget": {
      "max_ops": 128,
      "max_join_depth": 3,
      "max_fanout": 64,
      "max_total_cost": 256.0
    }
  },
  "plan": {
    "request_id": "req-C31-CORE-001-happy-fetch-project-assert",
    "steps": [
      {
        "out": "r0",
        "op": {
          "kind": "fetch",
          "handle_ref": "H0"
        }
      },
      {
        "out": "r1",
        "op": {
          "kind": "project",
          "in_reg": "r0",
          "field_paths": [
            "meta.subject"
          ]
        }
      },
      {
        "out": "r2",
        "op": {
          "kind": "assert",
          "assertion_type": "ASSERT_WORLD_FACT",
          "bindings": {
            "subject": {
              "reg": "r1",
              "field_path": "meta.subject"
            }
          },
          "citations": []
        }
      }
    ],
    "outputs": [
      "r2"
    ]
  },
  "execute_options": {
    "allow_partial_on_stall": false,
    "degraded_mode": false,
    "broken_lineage_handles": [],
    "narrative_templates": []
  },
  "expect": {
    "status": "OK",
    "error_code": null,
    "semantic_root": "1e97d407ff5521294dc37df6ec1b8dfdf96879a37029bdf2298f011cdabe5229",
    "verified_blocks": [
      "ASSERT_WORLD_FACT: subject=user:vinz"
    ],
    "stall": null
  },
  "determinism": {
    "assert_response_cpe_sha256": "4752f577dddd0ec8f28581ca8763b9f613d0470970c9095688ee49837777db0a",
    "assert_semantic_root": true
  }
}
